{
  "issue": 1,
  "week": "2026-43",
  "date": "2026-10-19",
  "covers": {
    "from": "2026-10-05",
    "to": "2026-10-18"
  },
  "title": "Robots get funded, geotech meets live data, concrete goes round",
  "summary": "Construction robotics drew big money this week: ICON's multi-storey 3D printer, Origin's wall-finishing robot and All3's legged site robots. Hexagon is buying the geotechnical software maker Rocscience to feed live sensor data into engineering models, a Dutch start-up got €100M to recycle demolition concrete into new concrete, and a new EU project wants reclaimed building parts to get a 'beautiful' second life. Our focus: what BIM really is, and why it is not yet a digital twin.",
  "generated": {
    "by": "Claude (Anthropic), scheduled FPL Weekly task",
    "method": "Web search over news from the covered period, then reading the original or best available source for every item (company releases, institutions, specialist press). Selection, explanations and summaries are written by AI. Company figures are marked as claims. Items 5 and 7 are slightly older than the window and are included for context. Revised on 21 Oct 2026 with the editorial standards in the README.",
    "created_at": "2026-10-21T09:30:00+02:00"
  },
  "news": [
    {
      "id": "icon-series-d",
      "category": "robotics",
      "title": "ICON, the US pioneer of 3D-printed houses, raises $200M to build multi-storey printers",
      "body": "ICON, an Austin-based company that builds houses with a robotic 3D printer and its own cement-based material, has closed a $200 million Series D round co-led by Baillie Gifford and funds managed by BlackRock. The money goes into making and deploying more robotic systems, a large R&D site in Austin, and expansion in Texas, Florida and Washington D.C. ICON says it has built more than 270 homes and structures and is preparing commercial production of Titan, a multi-storey printer. It claims Titan shortens the build of an average home by six weeks and cuts cost by 40% compared with the national average (company figures, not independently verified). Press reports put the company's valuation at about $1.4 billion; ICON's release does not state it.\n\nWhy it matters: once a printer can build several storeys, the wall itself becomes a machine instruction. Geometry, layer heights and openings have to be planned for the printer, not only for the drawing.",
      "background": "ICON (Austin, Texas) prints buildings: a robotic printer lays down the company's own cement-based mix, called FormCrete, layer by layer, so walls are built without formwork. ICON works in three units: Build (it builds projects itself), Tech (printers and software) and Prime (defense and space, including NASA work on construction on the Moon). Known projects are Wolf Ranch near Georgetown, Texas, described as the largest community of 3D-printed homes, and housing at Community First! Village in Austin. Titan is the next machine, made for taller, multi-storey walls. The $200M is a Series D, a late-stage investment round.",
      "region": "US",
      "topics": [
        "3d-printing",
        "funding",
        "robotics"
      ],
      "source_type": "primary",
      "source_name": "ICON press release (via Pulse 2.0)",
      "source_url": "https://pulse2.com/icon-raises-200-million-series-d-co-led-by-baillie-gifford-and-blackrock/",
      "more_sources": [
        {
          "name": "Construction Dive",
          "url": "https://www.constructiondive.com/news/3d-printing-giant-icon-raises-funding/833001/"
        },
        {
          "name": "Bisnow (valuation)",
          "url": "https://www.bisnow.com/news/national/proptech/blackrock-baillie-gifford-icon-series-d-valuation"
        }
      ],
      "published_at": "2026-10-13",
      "image_url": null,
      "image_credit": null
    },
    {
      "id": "origin-og1",
      "category": "robotics",
      "title": "Origin, a US start-up founded in 2025, launches a wall-finishing robot with $20M",
      "body": "Origin, a San Francisco start-up founded in early 2025, has come out of stealth with $20 million, co-led by Accel and Zacua Ventures. Its first robot, OG-1, finishes drywall: it applies joint compound, sands and primes walls, reaching up to 14 feet (about 4.3 m), and uses force control for sanding. It is steered by what Origin calls a Construction Action Model, an AI model trained in simulation and on live job sites. The company says it already works with two of the largest drywall-finishing contractors in the US, plans pilots in Germany, Sweden, France and Saudi Arabia and aims for 150 robots by the end of 2027. It claims three times human speed at human-level quality; these are its own figures.\n\nWhy it matters: finishing trades are labour-intensive and short of workers. If robots take them over, tolerances and surface quality become something you specify and measure, not something you negotiate on site.",
      "background": "Origin does not sell one gadget but robot capacity for interior work. OG-1 is a modular three-wheeled platform with swappable tools, so the same hardware can later also tape, install drywall, drill or install conduit. A software layer the company calls Construction Action Model plans the work, navigates and turns decisions into movements; it is trained in simulation and on live job sites. The robot is meant to work next to crews without a fenced-off zone. First robots were on New York sites within 10 months of the founding. Drywall finishing itself means filling the joints between plasterboards, sanding and priming, so the wall can be painted.",
      "region": "US",
      "topics": [
        "robotics",
        "interior-finishing",
        "funding"
      ],
      "source_type": "primary",
      "source_name": "Origin press release (via Pulse 2.0)",
      "source_url": "https://pulse2.com/origin-20-million-funding/",
      "more_sources": [
        {
          "name": "Robotics & Automation News",
          "url": "https://roboticsandautomationnews.com/2026/10/19/origin-raises-20-million-to-scale-general-purpose-construction-robots/106024/"
        }
      ],
      "published_at": "2026-10-15",
      "image_url": null,
      "image_credit": null
    },
    {
      "id": "all3-koblenz",
      "category": "robotics",
      "title": "All3 plans to send four-legged robots to a Koblenz housing site in 2027",
      "body": "The London-founded start-up All3 plans to use its four-legged robots on a 'micro living' housing project in Koblenz, Germany, starting in early 2027. According to a story published by Stacker for Nebius's blog (branded content), the robots arrive in a shipping container and go to work autonomously. All3 combines three parts: an AI design platform, compact factories that make building components, and the robots that assemble them on site. Its CEO says every building must be designed for what today's robots can actually do. All3 claims up to 30% lower cost, up to 50% shorter timelines and up to a quarter less CO2 than conventional construction (company claims), and admits that people are still needed for parts of the process.\n\nWhy it matters: All3 sells a chain from design software to factory to site, not a single robot. That integration is exactly what the split between planner, manufacturer and contractor usually prevents.",
      "background": "All3's approach is to design the building so that robots can build it. Three parts work together: an AI-led design platform that keeps a design within the rules and within what today's robots can do; compact factories that make the building components; and four-legged robots that arrive in a shipping container and assemble the components on site. The CEO's reasoning: every plot and street is unique, so each building must be unique too, and that only works if design, production and assembly are planned as one chain. Context: McKinsey (2026) notes that construction labour productivity rose only about 10% between 2000 and 2022, against about 90% in manufacturing.",
      "region": "UK",
      "topics": [
        "dfma",
        "robotics",
        "timber"
      ],
      "source_type": "branded",
      "source_name": "Stacker for The Infinite Loop by Nebius (branded content)",
      "source_url": "https://stacker.com/stories/ai/ai-moving-construction-site",
      "more_sources": [
        {
          "name": "All3: Mantis robot",
          "url": "https://ts.core.all3.com/mantis"
        },
        {
          "name": "McKinsey: How AI is reshaping the AEC industry",
          "url": "https://www.mckinsey.com/industries/capital-projects-and-infrastructure/our-insights/how-ai-is-reshaping-the-future-of-the-aec-industry"
        }
      ],
      "published_at": "2026-10-13",
      "image_url": null,
      "image_credit": null
    },
    {
      "id": "hexagon-rocscience",
      "category": "digital",
      "title": "Hexagon, the Swedish measurement-technology group, buys geotech software maker Rocscience for $535M",
      "body": "Hexagon has agreed to buy Rocscience, a Toronto company whose software models rock, soil and structures: slope stability, ground movement, tunnels and dams. The price is US$535 million, closing is expected in the fourth quarter of 2026. Rocscience software is used in around 125 countries and the company expects revenue approaching $50 million in 2026. Hexagon wants to connect these simulations with its radar and sensor monitoring, so that live measurements continuously update and calibrate the engineering model from design through construction and operation. It says this would allow earlier detection of risks and faster intervention.\n\nWhy it matters: this is the step from model to digital twin (see this week's focus). For geotechnical engineers the design model could stay alive after handover and keep learning from the ground it describes.",